date,Impact - USD,Headline,Impact - Raw,Impact - units recalled,Impact - injured or killed,Impact - duration,Impact - duration unit,Impact - hours,Impact - customers affected,Impact - Qty,Currency Symbol,Impact - Currency,Country,Region,Failure Type,Organization Type,Government Type,Government Department,Industry Area,url,Project,Companies,Theme
2007-07-01,177114866,Irish Health Services Executive Abandons €131 million Payroll System PPARS,Costs had climbed from €9 million to €131 million since 2005.,,,,,,,131000000,€,EUR,Ireland,"Europe, Middle East, and Africa",Project Failure,Government,National,Health and Human Services,,http://www.irishhealth.com/article.html?id=11805,,,"payroll, health"
2007-08-01,,New $95 Million Los Angeles Unified School District Payroll System Doesn't Work,"Tens of thousands of teachers, cafeteria workers, classroom aides and others have been underpaid, overpaid, or not paid at all.",,,,,,50000,,,,US,The Americas,Operational Failure,Government,State/Local,Education,,http://spectrum.ieee.org/riskfactor/computing/it/la_school_system_blunder,,,payroll
2013-08-01,1.67E8,Pennsylvania Won't Renew Contract with IBM Over Botched Unemployment System,"Original cost was $106.9 Million, but over $167 Million was spent and the project was 3 years late and still missing critical functionality.",,,,,,,1.67E8,$,USD,US,The Americas,Project Failure,Government,State/Local,Labor,,http://spectrum.ieee.org/riskfactor/computing/it/pennsylvania-wont-renew-ibms-contract-for-botched-project,,,contract termination/cancellation
2008-06-01,15814402,Swansea City Council Cancels £800K Payroll Project after £8 Million Cost Overrun,The project resulted in a £8 Million loss.,,,,,,,8000000,£,GBP,UK,"Europe, Middle East, and Africa",Project Failure,Government,State/Local,Information Technology,,http://spectrum.ieee.org/riskfactor/computing/it/how_do_you_create_a_8_million,,,"project termination/cancellation, payroll"
2010-10-01,9.0E7,Verizon Overbills 15 Million Customers for Years Due to Software Errors,There were $90 Million in overcharges during that time,,,,,,15000000,9.0E7,$,,US,The Americas,Operational Failure,Commercial,,,Telecom,http://spectrum.ieee.org/riskfactor/telecom/wireless/verizon-overbilled-15-million-customers-for-years-because-of-software-errors,,,"billing, telecom"
2009-11-01,1.89E8,"Processing Error Withdraws Pension Checks of 66,000 Retired New York City Teachers",$189 Million was accidentally sent back to state.,,,,,,66000,1.89E8,$,USD,US,The Americas,Operational Failure,Government,State/Local,Education,,http://spectrum.ieee.org/riskfactor/computing/it/processing-error-withdraws-pension-checks-of-66000-retired-new-york-city-teachers,,,payroll
2010-08-01,5000000,24 Virginia State Agencies Knocked Offline by Server Problems,Problems last over a week for some agencies. The state later fined Northrop Grumman $5 million for the the outages.,,,1,weeks,168,,5000000,$,USD,US,The Americas,Operational Failure,Government,State/Local,Information Technology,,http://spectrum.ieee.org/riskfactor/computing/it/virginia-state-agencies-still-suffering-from-server-problems;  http://www.computerworld.com/article/2515423/data-center/northrop-grumman-takes-blame-for-va--it-services-outage.html; http://spectrum.ieee.org/riskfactor/computing/it/virginias-2-billion-outsourced-it-contract-in-shambles; http://www.washingtonpost.com/blogs/virginia-politics/post/virginia-fines-northrop-grumman-nearly-5m-for-massive-computer-outage/2011/05/19/AF9eLB7G_blog.html,Northrop Grumman,,system outage/crash
2011-06-01,7.2E8,"US Government Files Fraud Charges over CityTime Billing, New York Wants SAIC to Pay Back $600 Million in Billings",The total project cost billed was $720 Million.,,,,,,,7.2E8,$,USD,US,The Americas,Project Failure,Government,State/Local,Finance and Treasury,,http://spectrum.ieee.org/riskfactor/computing/it/new-york-city-to-citytime-prime-contractor-saic-fork-over-our-600-million; http://spectrum.ieee.org/riskfactor/computing/it/nyc-bigtime-citytime-fraud-charges-ripples-on,,SAIC,payroll
2013-02-01,50000000,California Cancels $89.7 Million MyCalPAYS Payroll Modernization System,"$50 Million was spent, but 5 Phase system development never made it past Phase 1.",,,,,,,50000000,$,USD,US,The Americas,Project Failure,Government,State/Local,Finance and Treasury,,http://spectrum.ieee.org/riskfactor/computing/it/californias-payroll-project-debacle-another-50-million-up-in-smoke,,SAP,"project termination/cancellation, payroll"
2007-08-01,,Skype Software Update Takes it Down,Millions of users affected for two days,,,2,days,48,220000000,,,,Worldwide,Worldwide,Operational Failure,Commercial,,,Telecom,http://spectrum.ieee.org/riskfactor/computing/it/skype_scuppered; http://www.nytimes.com/2007/08/21/business/worldbusiness/21skype.html?pagewanted=print&_r=0; http://heartbeat.skype.com/2007/08/what_happened_on_august_16.html; http://www.cnet.com/news/skypes-unprecedented-outage/,,"Microsoft, Skype",telecom
2008-02-01,,BlackBerry Goes Dark Across North America,Software update blamed,,,3,hours,3,,,,,North America,The Americas,Operational Failure,Commercial,,,Telecom,http://spectrum.ieee.org/tech-talk/semiconductors/devices/blackberry_service_outage_hits,,BlackBerry,telecom
2008-07-01,,"Cut Optus Fibre Optic Cable Affect 1 Million Customers in Queensland, Australia","Cut causes major land line, mobile phone and internet shutdown for over four hours.",,,4,hours,4,1000000,,,,Australia,Asia Pacific and Japan,Operational Failure,Commercial,,,Telecom,http://spectrum.ieee.org/riskfactor/computing/it/fun_in_the_land_of_oz,,,telecom
2008-12-01,,Undersea Cables Damaged in Mediterranean Sea,"Internet, data and telephone communications disrupted for days across the eastern Mediterranean region. A France Telecom report listed 14 countries affected by the current problem. The cables were repaired on 31 December 2008.",,,12,days,288,,,,,EMEA,"Europe, Middle East, and Africa",Operational Failure,Commercial,,,Telecom,http://spectrum.ieee.org/riskfactor/computing/it/undersea_cables_damaged_in_med; http://www.wired.com/2008/12/mediterranean-c/; http://www.osa-opn.org/home/articles/volume_25/march_2014/features/sea_change_the_challenges_facing_submarine_optical/#.VXgrjvlVhBc,,,telecom
2009-09-01,,Gmail Goes Down,"The service was down for about 2 hours, hitting 150 Million users.",,,2,hours,2,150000000,,,,Worldwide,Worldwide,Operational Failure,Commercial,,,Telecom,http://spectrum.ieee.org/riskfactor/computing/it/google-gmail-should-be-working-again,,,telecom
2009-10-01,,T-Mobile Temporarily Stops Selling Sidekick Phones after Massive  User Data Loss,Sidekick owners lost their data due to Microsoft data center issues.,,,,,,800000,,,,US,The Americas,Operational Failure,Commercial,,,Telecom,http://spectrum.ieee.org/riskfactor/computing/it/tmobile-temporarily-stops-selling-sidekick-phones; http://www.zdnet.com/article/t-mobile-sidekick-data-outage-tests-mettle-of-800000-customers-carrier/,,"Microsoft, T-Mobile",telecom
2009-12-01,,Blackberry Suffers Back to Back Outages,The company blames an update of their messenger software.,,,8,hours,8,1.88E7,,,,US,The Americas,Operational Failure,Commercial,,,Telecom,http://spectrum.ieee.org/riskfactor/telecom/wireless/blackberry-zeroing-in-on-cause-of-recent-outages; http://www.cnn.com/2009/TECH/12/23/blackberry.outage/; http://www.statista.com/statistics/232792/forecast-of-rim-users-in-the-us/,,BlackBerry,telecom
2010-12-01,,Comcast Suffers Major East Coast Outage Lasting for 15 Hours,"The company blames it on a ""server issue.""",,,15,hours,15,,,,,US,The Americas,Operational Failure,Commercial,,,Telecom,http://spectrum.ieee.org/riskfactor/telecom/internet/comcast-suffers-major-internet-outage,,,telecom
2011-04-01,,Georgian Woman Accused of Accidentally Bringing Down Armenia's Internet with Shovel,The 75-year old was likely scavenging for wiring to sell as scrap.,,,12,hours,12,,,,,Georgia,"Europe, Middle East, and Africa",Operational Failure,Commercial,,,Telecom,http://spectrum.ieee.org/riskfactor/telecom/internet/georgian-woman-accidentally-brings-down-armenias-internet,,,telecom
2011-10-01,,"BlackBerry Experiences Email and Internet Outages across Europe, the Middle East, and Africa",Servers were blamed for disruptions that last almost three days and affected over 40 Million customers.,,,3,days,72,4.0E7,,,,EMEA,"Europe, Middle East, and Africa",Operational Failure,Commercial,,,Telecom,http://spectrum.ieee.org/riskfactor/telecom/wireless/glitch-leaves-millions-of-blackberry-owners-without-email-internet,,BlackBerry,telecom
2012-07-01,25254407,France Telecom Mobile 10-Hour Outage Affects 26 Million Subscribers,Compensation estimated to cost up to €20 Million.,,,10,hours,10,26000000,20000000,€,EUR,France,"Europe, Middle East, and Africa",Operational Failure,Commercial,,,Telecom,http://spectrum.ieee.org/riskfactor/telecom/wireless/france-tlcom-mobile-network-outage-affecting-26-million-subscribers-angers-government-ministers; http://in.reuters.com/article/2012/07/11/francetelecom-outage-idINL6E8IBBND20120711,,,telecom
2012-09-01,,"Blackberry Email and Internet Disrupted for Three Hours in Europe, the Middle East and Africa","Blackberry blamed a ""service issue.""",,,3,hours,3,,,,,EMEA,"Europe, Middle East, and Africa",Operational Failure,Commercial,,,Telecom,http://spectrum.ieee.org/riskfactor/telecom/wireless/blackberry-service-issue-underscores-apple-iphone-5-launch,,BlackBerry,telecom
2010-05-01,,NYSE Trading Goes Haywire,The exchange suddenly drops more than 587 points. The cause was later traced to a trading algorithm.,,,6,minutes,0.1,,,,,US,The Americas,Operational Failure,Commercial,,,Stock Exchanges,http://spectrum.ieee.org/riskfactor/computing/it/man-the-hatches-new-york-stock-market-trading-goes-haywire,,,stock exchange
2005-03-01,1.7E8,FBI Cancels Virtual Case File System,The failed project cost $170 Million.,,,,,,,1.7E8,$,USD,US,The Americas,Project Failure,Government,National,Law Enforcement,,http://www.computerworld.com/article/2569344/app-development/fbi-scuttles--170m-system-for-managing-investigations.html;https://oig.justice.gov/reports/FBI/a0507/exec.htm,FBI VCF/Sentinel,SAIC,project termination/cancellation
2005-12-01,27900000,Colorado Department of Labor & Employment’s Terminates State Unemployment IT Project Genesis,$27.9 Million was spent on the unsuccessful project.,,,,,,,27900000,$,USD,US,The Americas,Project Failure,Government,State/Local,Labor,,http://www.leg.state.co.us/osa/coauditor1.nsf/All/22147172A4CF63D787257331006E6610/$FILE/1778%20Genesis%20Project%20Perf%20MEMO%208-6-07.pdf,,,project termination/cancellation
2005-12-01,1.83E7,US DHS Cancels Emerge2 Program,$18.3 Million was already spent.,,,,,,,1.83E7,$,USD,US,The Americas,Project Failure,Government,National,Law Enforcement,,http://fcw.com/articles/2006/03/30/emerge2s-failure-sends-dhs-back-to-drawing-board.aspx?admgarea=TC_Management,,SAP,project termination/cancellation
2006-01-01,1175015,FBI Terminates Laboratory Information Management System Project,The program cost the FBI $1.2 Million and the project was already two years late.,,,,,,,1175015,$,USD,US,The Americas,Project Failure,Government,National,Law Enforcement,,http://www.justice.gov/oig/reports/FBI/a0633/final.pdf,,,project termination/cancellation
2006-07-01,14400000,US Treasury Dept. Cancels $15.1 Million BSA Direct R&S Project,$14.4 Million was wasted on a project initially estimated to cost $8.9 million. And it still didn't work.,,,,,,,14400000,$,USD,US,The Americas,Project Failure,Government,National,Finance and Treasury,,http://www.fincen.gov/news_room/nr/html/20060713.html,,,project termination/cancellation
2006-07-01,840240132,UK Terminates Child Support Agency undermined by IT System Failure,£456 Million was spent on a failed system.,,,,,,,456000000,£,GBP,UK,"Europe, Middle East, and Africa",Project Failure,Government,National,Health and Human Services,,http://www.computerweekly.com/news/2240077941/IT-failures-help-speed-demise-of-Child-Support-Agency,,,project termination/cancellation
2006-09-01,266712389,UK Scraps Department of Work  and Pensions Benefits Processing Replacement Programme,£141 Million was spent with no payoff.,,,,,,,1.4E8,£,GBP,UK,"Europe, Middle East, and Africa",Project Failure,Government,National,Labor,,http://www.computerweekly.com/news/2240078312/DWP-shelves-140m-benefits-processing-system,,,project termination/cancellation
2007-02-01,23600000,Wisconsin Pulls Plug on $41.2 Million  EnABLES Unemployment Insurance Project,"$23.6 Million was spent on the system that was supposed to be built over 7 phases. Phase 1 worked and cost $13 Million, while phase 2 never worked and cost $10 Million.",,,,,,,23600000,$,USD,US,The Americas,Project Failure,Government,State/Local,Labor,,http://www.jsonline.com/news/wisconsin/29386584.html,,,project termination/cancellation
2007-03-01,77675803,RCMP Canadian Firearms Program Cancelled,The government is on the hook for CN$91 Million.,,,,,,,9.1E7,$,CAD,Canada,The Americas,Project Failure,Government,National,Law Enforcement,,http://www.thestar.com/news/2007/11/08/gun_registry_contract_cancelled_after_81m_spent.html?app=noRedirect,,CGI,project termination/cancellation
2007-07-01,3820955,Australia Cancels AU$4.5 Million Firelink Wildfire Communications System Project,AU$4.5 million was wasted in the effort.,,,,,,,4500000,$,AUD,Australia,Asia Pacific and Japan,Project Failure,Government,National,Law Enforcement,,http://www.abc.net.au/news/2007-07-13/act-firelink-system-waste-of-money/2501524,,,project termination/cancellation
2008-01-01,407819795,UK Cancels $750 Million C-NOMIS Prison IT System,The cost to cancel was £205 Million.,,,,,,,205000000,£,GBP,UK,"Europe, Middle East, and Africa",Project Failure,Government,National,Law Enforcement,,http://spectrum.ieee.org/riskfactor/computing/it/uk_cancels_750_million_prison,,,project termination/cancellation
2008-03-01,1219730740,Australian Super Seasprite Helo Electronic Upgrade Cancelled,The estimated taxpayer cost was AU$1.3 Billion.,,,,,,,1300000000,$,AUD,Australia,Asia Pacific and Japan,Project Failure,Government,National,Defense and Veterans Affairs,,http://spectrum.ieee.org/riskfactor/computing/it/it_mercy_rule_called_seasprite; http://spectrum.ieee.org/riskfactor/computing/it/australian_super_seasprite_sof,,,project termination/cancellation
2009-06-01,3.3E9,DoD Cancels $26 Billion Transformational Satellite Program,"$3.3 billion was spent on the program. The cost estimates basically doubled from an initial $12-15 Billion. The official termination was June 2009, but DefSec Gates made the decision in April 2009.",,,,,,,3.3E9,$,USD,US,The Americas,Project Failure,Government,National,Defense and Veterans Affairs,,http://www.defense.gov/Contracts/Contract.aspx?ContractID=4043; http://spacenews.com/pentagon-cancels-t-sat-program-trims-missile-defense/; https://www.whitehouse.gov/sites/default/files/omb/budget/fy2010/assets/trs.pdf,,,project termination/cancellation
2009-06-01,1.8E10,$200 Billion US Army Future Combat System Program Terminated,$18 Billion was spent before cancellation.,,,,,,,1.8E10,$,USD,US,The Americas,Project Failure,Government,National,Defense and Veterans Affairs,,http://spectrum.ieee.org/riskfactor/computing/it/us-army-future-combat-systems-program-formally-terminated,,,project termination/cancellation
2009-09-01,127000000,VA Scraps $167 Million Scheduling Replacement Projecect After 9 Years,$127 million in costs were written off.,,,,,,,127000000,$,USD,US,The Americas,Project Failure,Government,National,Defense and Veterans Affairs,,http://www.gao.gov/new.items/d10579.pdf; http://www.nextgov.com/defense/whats-brewin/2014/05/remember-va-replacement-scheduling-project/84523/,,,project termination/cancellation
2010-02-01,1000000000,DoD Cancels Defense Integrated Military Human Resources System After Spending $1 Billion and 12 years of effort,$1 billion was spent with little to show for it.,,,,,,,1000000000,$,USD,US,The Americas,Project Failure,Government,National,Defense and Veterans Affairs,,http://articles.dailypress.com/2010-02-21/news/dp-local_milupdate_0222feb22_1_military-personnel-payroll-navy-and-air-force; http://www.dodig.mil/audit/reports/fy10/10-041redacted.pdf,,,project termination/cancellation
2010-02-01,6.0E9,US Government Abandons $13.9 Billion National Polar-orbiting Operational Environmental Satellite System Project,Nearly $6 Billion was spent and only one limited-life NASA satellite was almost ready to launch.,,,,,,,6.0E9,$,USD,US,The Americas,Project Failure,Government,National,Defense and Veterans Affairs,,http://www.whitehouse.gov/sites/default/files/npoess_decision_fact_sheet_2-1-10.pdf; http://gop.science.house.gov/Media/hearings/oversight10/june29/Powner.pdf; http://www.gpo.gov/fdsys/pkg/CHRG-112hhrg68320/html/CHRG-112hhrg68320.htm,,,project termination/cancellation
2010-05-01,392860036,UK Scraps £5.3 Billion National Identity Register Project,£257 Million of investment was wasted.,,,,,,,257000000,£,GBP,UK,"Europe, Middle East, and Africa",Project Failure,Government,National,Law Enforcement,,http://www.zdnet.com/article/id-cards-why-they-were-destined-to-fail/; http://www.washingtonpost.com/wp-dyn/content/article/2007/08/12/AR2007081200379.html,,,project termination/cancellation
2010-12-01,732556105,UK FiReControl Project Axed after Costs Escalate from £100 Million to over £423 Million,The project was terminated in December 2010 after spending £250 million and producing nothing of material value. Another £219 million in committed costs bring the total so far to £469 million.,,,,,,,469000000,£,GBP,UK,"Europe, Middle East, and Africa",Project Failure,Government,National,Law Enforcement,,http://spectrum.ieee.org/riskfactor/computing/it/uk-firecontrol-project-finally-axed,,,project termination/cancellation
2011-03-01,,Computer Problems at Japan's Mizuho Bank Continued into Second Week,Millions of financial transactions had processing delays for a week. ATMs were affected for 5 days.,,,5,days,120,1000000,,,,Japan,Asia Pacific and Japan,Operational Failure,Commercial,,,Banking and Financial,http://spectrum.ieee.org/riskfactor/computing/it/japans-mizuho-bank-computer-problems-persist-in-second-week,,,bank
2011-07-01,45000000,Chicago's Project Shield Canceled after 8 Years and $45 Million Wasted,An audit report stated that there was virtually no project management or oversight.,,,,,,,45000000,$,USD,US,The Americas,Project Failure,Government,State/Local,Law Enforcement,,http://spectrum.ieee.org/riskfactor/computing/it/chicago-project-shields-depressing-post-mortem,,,project termination/cancellation
2011-10-01,90800000,VA’s $608 Million Financial and Logistics Integrated Technology Enterprise Project Canceled,$90.8 Million was wasted on the project.,,,,,,,90800000,$,USD,US,The Americas,Project Failure,Government,National,Defense and Veterans Affairs,,http://fcw.com/articles/2010/07/13/va-cancels-flite-program.aspx; http://www.va.gov/oig/pubs/VAOIG-11-00324-20.pdf,,,project termination/cancellation
2011-11-01,,Maintenance Issue Takes Down UK RBS and NatWest's Online and Telephone Banking Systems,15 Million customers were affected.,,,1,days,24,15000000,,,,UK,"Europe, Middle East, and Africa",Operational Failure,Commercial,,,Banking and Financial,http://spectrum.ieee.org/riskfactor/computing/it/millions-in-uk-affected-by-it-system-glitches-at-hsbc-rbs-and-natwest-banks-over-past-few-days,,,bank
2013-02-01,134000000,California Cancels $208 Million DMV Modernization IT Project,"$134 Million was spent over 6 years, but the project didn't make any real progress.",,,,,,,134000000,$,USD,US,The Americas,Project Failure,Government,State/Local,Transportation,,http://spectrum.ieee.org/riskfactor/computing/it/dj-vu-all-over-again-californias-dmv-it-project-cancelled,,HP,project termination/cancellation
2013-04-01,22529825,UK Surrey Police Siren Criminal Investigation System Canceled,The £15 Million investment was found not fit for its purpose.,,,,,,,1.48E7,£,GBP,UK,"Europe, Middle East, and Africa",Operational Failure,Government,State/Local,Law Enforcement,,http://www.bbc.com/news/uk-27911416,,,project termination/cancellation
2013-05-01,153096708,BBC Blows £98.4 Million on Failed Digital Media Initiative,"After spending £98.4 Million, the BBC admits to poor project management.",,,,,,,98400000,£,GBP,UK,"Europe, Middle East, and Africa",Project Failure,Government,National,Commerce and Communications,,http://spectrum.ieee.org/riskfactor/computing/it/bbc-blows-984m-on-digital-media-initiative-project,,,project termination/cancellation
2013-06-01,2.0E7,Tennessee Cancels $37 Million Vision Integration Platform (VIP) Project,The project was in its 7th year and had cost $20 Million without producing much of value.,,,,,,,2.0E7,$,USD,US,The Americas,Project Failure,Government,State/Local,Health and Human Services,,http://archive.wbir.com/rss/article/271940/2/-State-pulls-plug-on-multi-million-dollar-computer-system,,,project termination/cancellation
2013-10-01,2.79E7,Alaska Public Safety Information Network Database Modernization Quietly Killed After 11 years of Effort And $28 Million,"Modernization of APSIN, Alaska's criminal information database, was abandoned when it couldn't be made to work properly after $28 Million spent.",,,,,,,2.79E7,$,USD,US,The Americas,Project Failure,Government,State/Local,Law Enforcement,,http://www.adn.com/article/20150207/alaska-government-spent-nearly-28-million-botched-database-project,,,project termination/cancellation
2014-04-01,166339993,Victoria Government Finally Kills AU$180 Million Ultra Schools Portal,"The project cost was triple the original AU$60 Million estimate, and only 4% of schools ever used the system.",,,,,,,1.8E8,$,AUD,Australia,Asia Pacific and Japan,Project Failure,Government,State/Local,Education,,http://www.theage.com.au/victoria/plug-pulled-on-schools-disastrous-ultranet-computer-system-20140419-36xse.html,,,project termination/cancellation
2014-09-01,57768786,Netherlands Social Insurance Bank SVB Scraps New €44 Million IT System after Persistent Failures,Termination resulted in a €44 Million write-off.,,,,,,,44000000,€,EUR,Netherlands,"Europe, Middle East, and Africa",Project Failure,Government,National,Health and Human Services,,http://www.dutchnews.nl/news/archives/2014/09/social_insurance_bank_scraps_n.php/,,,project termination/cancellation
2015-03-01,1000000,"Rutherford County, Tennessee Pulls Plug on $1 million Court Management System","The county spent 2 years and $1 Million trying to modernize their old court management system, without success. Litigation is likely.",,,,,,,1000000,$,USD,US,The Americas,Project Failure,Government,State/Local,Law Enforcement,,http://www.dnj.com/story/news/2015/03/21/million-dollar-glitch/25166703/,,,project termination/cancellation
2006-07-01,31000000,North Carolina Cancels New  $171 Million Medicaid Development,$31 Million was spent before cancellation.,,,,,,,31000000,$,USD,US,The Americas,Project Failure,Government,State/Local,Health and Human Services,,http://gcn.com/articles/2006/07/19/north-carolina-ends-medicaid-pact-with-acs.aspx; http://www.ncleg.net/DocumentSites/committees/JLOCIT/10-08-2013/Fiscal%20Research_NCTracks%20Information%20Paper-2013-10-08.pdf,,EDS,"project termination/cancellation, health"
2011-11-01,,IT Problem Takes Down UK HSBC's Online Banking and ATM System,15 Million customers affected,,,2,hours,2,15000000,,,,UK,"Europe, Middle East, and Africa",Operational Failure,Commercial,,,Banking and Financial,http://spectrum.ieee.org/riskfactor/computing/it/millions-in-uk-affected-by-it-system-glitches-at-hsbc-rbs-and-natwest-banks-over-past-few-days,,,bank
2011-09-01,20561706978,UK Terminates £12.7 Billion National Electronic Health Record Program,Over £12 Billion is thought to be wasted.,,,,,,,1.27E10,£,GBP,UK,"Europe, Middle East, and Africa",Project Failure,Government,National,Health and Human Services,,http://spectrum.ieee.org/riskfactor/computing/it/npfit-dismantled-uk-government-announces-end-of-its-127-billion-national-electronic-health-record-program,,,"project termination/cancellation, health"
2012-05-01,585860071,Victoria Australia Terminates Troubled HealthSMART Electronic Health Record System,AU$566 Million was spent with little to show for it. The original cost in 2007 was estimated to be AU$323 Million.,,,,,,,5.66E8,$,AUD,Australia,Asia Pacific and Japan,Project Failure,Government,State/Local,Health and Human Services,,http://spectrum.ieee.org/riskfactor/computing/it/troubled-healthsmart-system-finally-cancelled-in-victoria-australia-,,,"project termination/cancellation, health"
2013-02-01,1300000000,DOD Cancels Interoperable Electronic Health Record System Project,$1.3 billion was spent before cancellation.,,,,,,,1300000000,$,USD,US,The Americas,Project Failure,Government,National,Defense and Veterans Affairs,,http://www.defense.gov/transcripts/transcript.aspx?transcriptid=5187; http://www.ihealthbeat.org/articles/2013/8/29/va-pentagon-spent-at-least-13b-on-canceled-joint-ehr-system?view=print,,,"project termination/cancellation, health"
2014-01-01,1.25E7,Federal Government Fires Health Exchange Contractor,"CGI's contract was not renewed, but it was paid at least $12.5 million.",,,,,,,1.25E7,$,USD,US,The Americas,Operational Failure,Government,National,Health and Human Services,,http://www.washingtonpost.com/politics/obama-administration-to-end-contract-with-cgi-federal-company-behind-healthcaregov/2014/01/10/001eb05a-719e-11e3-8b3f-b1666705ca3b_story.html; http://www.nationaljournal.com/health-care/obamacare-website-has-cost-840-million-20140730,,CGI,health
