date,Impact - USD,Headline,Impact - Raw,Impact - units recalled,Impact - injured or killed,Impact - duration,Impact - duration unit,Impact - hours,Impact - customers affected,Impact - Qty,Currency Symbol,Impact - Currency,Country,Region,Failure Type,Organization Type,Government Type,Government Department,Industry Area,url,Project,Companies,Theme
2006-10-01,6080991202,Airbus Blames Design Software Incompatibility for Airbus A380 Two Year Delay,The delay is responsible for €4.8 billion in lost earnings up to 2010.,,,,,,,4800000000,€,EUR,Europe,"Europe, Middle East, and Africa",Operational Failure,Commercial,,,Air Transport,http://www.bloomberg.com/bw/stories/2006-10-04/airbus-first-blame-the-software; http://www.spiegel.de/international/airbus-debacle-worsens-new-a380-delays-to-cost-billions-a-440642.html,,,project problems
2007-09-01,1009515695,UK Rural Payments Project Delays,The delay costs taxpayers £500 Million.,,,,,,,5.0E8,£,GBP,UK,"Europe, Middle East, and Africa",Project Failure,Government,National,Labor,,http://spectrum.ieee.org/riskfactor/computing/it/a_masterclass_in_bad_decisionm,,,project problems
2009-01-01,4521112135,UK MoD Defense Information System £3.1 Billion Over Budget,"The original cost was £4 Billion, but the cost is now estimated to be £7.1 Billion.",,,,,,,3.1E9,£,GBP,UK,"Europe, Middle East, and Africa",Project Failure,Government,National,Defense and Veterans Affairs,,http://spectrum.ieee.org/riskfactor/computing/it/uk_71bn_mod_it_project_running,,EDS,project problems
2009-09-01,34000000,"Wisconsin's Accountability, Consolidation, and Efficiency IT Project  Major Fiasco",Integrated Business Information System project costs grow from $150 Million to at least $184 Million.,,,,,,,34000000,$,USD,US,The Americas,Operational Failure,Government,State/Local,Information Technology,,http://spectrum.ieee.org/riskfactor/computing/it/wisconsins-accountability-consolidation-and-efficiency-initiative-it-projects-overrun-a-bit; http://wtnnews.com/articles/4684/; http://www.jsonline.com/news/statepolitics/after-troubled-launch-state-revives-massive-computer-overhaul-b99259892z1-257887491.html,,Oracle,project problems
2011-09-01,375000000,OMB Halts National Archives and Records Administration’s (NARA) $567 Million Electronic Records Archive (ERA) Project Development,The system operates with minimum functionality despite $375 Million spent.,,,,,,,375000000,$,USD,US,The Americas,Project Failure,Government,National,Information Technology,,http://www.federalnewsradio.com/697/2204570/NARA-to-suspend-development-of-ERA-starting-in-2012;http://federalnewsradio.com/in-depth/2011/10/nara-hires-ibm-to-move-records-system-into-next-phase/,,,project problems
2014-08-01,,LA Unified School District Court Mandated Student Educational Tracking System Flops,Thousands of students are without course schedules.,,,2,weeks,336,6500,,,,US,The Americas,Operational Failure,Government,State/Local,Education,,http://spectrum.ieee.org/riskfactor/computing/it/la-school-district-continues-suffering-misis-misery,,,project problems
2015-02-01,6.8E7,California's $96 million Business Licensing System in Trouble,"The system went live in 2013, but only 1/3 of the state boards and commissions online as promised. The original estimate was $28 million, but now it's at least $96 million for just 1/2 of the state boards.",,,,,,,6.8E7,$,USD,US,The Americas,Operational Failure,Government,State/Local,Commerce and Communications,,http://www.sacbee.com/news/politics-government/the-state-worker/article11272109.html; http://www.sacbee.com/news/politics-government/the-state-worker/article9918857.html; http://www.sacbee.com/news/politics-government/the-state-worker/article16486190.html; https://www.bsa.ca.gov/pdfs/factsheets/2014-116.pdf,,,project problems
2005-05-01,,Software bug causes 2004-2005 Toyota Prius to stall,"20,000 cars recalled",20000,,,,,,,,,US,The Americas,Operational Failure,Commercial,,,Auto and Land Transport,http://articles.latimes.com/2005/may/18/business/fi-cars18,,Toyota,cars
2009-11-01,2.5E8,Toyota Offers to Fix Gas Pedals and Software to Stop Runaway Cars,Toyota addresses the root cause of the potential risk for floor mat entrapment of accelerator pedals in certain Toyota and Lexus models.,3800000.0,4,,,,,2.5E8,$,USD,US,The Americas,Operational Failure,Commercial,,,Auto and Land Transport,http://spectrum.ieee.org/riskfactor/computing/it/toyota-will-offer-to-fix-gas-pedals-and-software-in-its-cars-to-stop-runaways; http://spectrum.ieee.org/riskfactor/computing/it/toyota-will-offer-to-fix-gas-pedals-on-cars-involved-in-recall; http://spectrum.ieee.org/riskfactor/computing/it/how-hard-should-it-be-to-stop-a-runaway-car,,Toyota,cars
2010-08-01,,Honda Updates Software on 2006-2008 Civic Hybrids to Extend Failing Batteries,"Batteries were degrading prematurely, affecting 100,000 Civics.",,,,,,100000,,,,Worldwide,Worldwide,Operational Failure,Commercial,,,Auto and Land Transport,http://spectrum.ieee.org/riskfactor/transportation/advanced-cars/software-fix-extends-failing-batteries-in-20062008-honda-civic-hybrids-is-cost-acceptable; http://www.hybridcars.com/civic-hybrid-owners-disappointed-battery-software-fix-28450/,,,cars
2011-08-01,,Honda Recalls 2.5 Million Vehicles for Transmission Software Updates,"Affected models included Accords, CR-Vs and Elements. 1.5 Million recalls were in the US.",2500000,,,,,,,,,Worldwide,Worldwide,Operational Failure,Commercial,,,Auto and Land Transport,http://spectrum.ieee.org/riskfactor/transportation/advanced-cars/honda-recalls-936000-more-vehicles-for-electrical-and-software-fixes,,,cars
2014-01-01,,"GM Recalls 370,000 Pickup Trucks for Software Update to Reduce Fire Risk",The recall hits 2014 Chevrolet Silverado and GMC Sierra models.,370000,,,,,,,,,US,The Americas,Operational Failure,Commercial,,,Auto and Land Transport,http://spectrum.ieee.org/riskfactor/computing/it/gm-recalls-370-000-pickup-trucks-for-software-update-to-reduce-fire-risk,,,cars
2014-02-01,,Toyota Recalls 1.9 Million Cars to Fix Software Flaw,Toyota software bug in power converter might cause car to slow down and stop unexpectedly.,1900000,,,,,,,,,Worldwide,Worldwide,Operational Failure,Commercial,,,Auto and Land Transport,http://spectrum.ieee.org/riskfactor/computing/it/toyota-recalls-19-million-prius-hybrids-over-software-flaw,,Toyota,cars
2014-03-01,,Nissan Recalls Nearly 1 Million Cars to Fix Air Bag Control Software,"The software installed on the vehicles may incorrectly determine that the passenger seat is empty when it is, in fact, occupied.",989708,,,,,,,,,Worldwide,Worldwide,Operational Failure,Commercial,,,Auto and Land Transport,http://spectrum.ieee.org/riskfactor/transportation/safety/nissan-recalls-nearly-1-million-cars-for-airbag-software-fix,,Nissan,cars
2005-03-01,8072387,Hudson Bay Co. ERP System Problems Contribute to Losses,Losses reached $10 Million.,,,,,,,1.0E7,$,CAD,Canada,The Americas,Operational Failure,Commercial,,,Retail,http://www.itbusiness.ca/news/hudsons-bay-cio-explains-big-ticket-it-problems/7791,,"Microsoft, IBM, Oracle",ERP
2008-07-01,4.7E7,Levi Strauss Reports 2nd Quarter Profits Hurt by ERP Integration That Stopped Orders for a Week,The cost of issue was $47 Million.,,,1,weeks,168,,4.7E7,$,USD,US,The Americas,Operational Failure,Commercial,,,Retail,http://www.accountingweb.com/topic/technology/levi-strauss-blames-profit-drop-sap-enterprise-software-system,,"Deloitte, SAP",ERP
2010-05-01,80000000,Waste Management and SAP Settle Lawsuit for $80 Million Over Failed ERP Project,The estimated cost was $80 million - this is the amount SAP was suing its insurer Swiss Re for to cover the settlement.,,,,,,,80000000,$,USD,US,The Americas,Project Failure,Commercial,,,Unknown,http://www.computerworld.com/article/2506049/data-center/sap-sues-insurer-over-waste-management-lawsuit-settlement.html; http://www.computerworld.com/article/2536212/enterprise-applications/waste-management-sues-sap-over-erp-implementation.html; http://www.infoworld.com/article/2648303/applications/waste-management-sues-sap-over-erp-implementation.html; ,,"SAP, Waste Management","ERP, project problems"
2010-11-01,3.3E7,"Portland, Oregon's Financial System Late and Over-budget","The original plan was $14 Million and 14-months to develop. Instead, it took $47 Million and 30-months.",,,,,,,3.3E7,$,USD,US,The Americas,Project Failure,Government,State/Local,Finance and Treasury,,http://spectrum.ieee.org/riskfactor/computing/it/city-of-portland-financial-and-hrpayroll-project-overbudget-by-over-30-million,,SAP,ERP
2012-11-01,1030000000,US Air Force Cancels $1 Billion Expeditionary Combat Support System (ECSS),Air Force admits that effort produced no significant military capability,,,,,,,1030000000,$,USD,US,The Americas,Project Failure,Government,National,Defense and Veterans Affairs,,http://spectrum.ieee.org/riskfactor/aerospace/military/us-air-force-blows-1-billion-on-failed-erp-project,,,"ERP, project termination/cancellation"
2013-11-01,200000000,Bridgestone Sues IBM for $600 Million over Failed ERP System,IBM says all the problems are Bridgestone's.,,,,,,,200000000,$,USD,US,The Americas,Project Failure,Commercial,,,Auto and Land Transport,http://spectrum.ieee.org/riskfactor/computing/it/bridgestone-sues-ibm-for-fraud-in-600-million-lawsuit-over-failed-it-implementation,,IBM,ERP
2014-11-01,1100000000,USAF $2.2 Billion Defense Enterprise Accounting Management System Enters Last Phase,The projecet is now scheduled to launch three years late (in 2017) and is $1.1 Billion over budget.,,,,,,,1100000000,$,USD,US,The Americas,Operational Failure,Government,National,Defense and Veterans Affairs,,http://defensesystems.com/Articles/2014/11/04/Air-Force-Accenture-DEAMS-final-phase.aspx,,,ERP
2005-02-01,,UK National Air Traffic Control System Crashes,Numerous flights were delayed.,,,33,minutes,0.505,,,,,UK,"Europe, Middle East, and Africa",Operational Failure,Commercial,,,Air Transport,http://www.computing.co.uk/ctg/news/1857231/more-failures-nats-west-drayton-control-centre,,,airport/port/customs systems
2005-06-01,649000000,United Airlines Finally Abandons the Automated Baggage-handling System at Denver International Airport,The cost of the abandoned system was $230 million. Another $70 million was spent on a conventional baggage system that replaced it. And $340 million more was paid in interest. It will cost $9 million over four years to demolish and cart away system the system.,,,,,,,649000000,$,USD,US,The Americas,Project Failure,Commercial,,,Air Transport,http://www.nytimes.com/2005/08/27/national/27denver.html?pagewanted=all.&_r=0; http://www.computerworld.com/article/2556725/it-project-management/united-axes-troubled-baggage-system-at-denver-airport.html; http://spectrum.ieee.org/riskfactor/computing/it/dia_the_final_end_of_the_autom; http://www.vaildaily.com/article/20080114/NEWS/762092730,,,"airport/port/customs systems, project termination/cancellation"
2005-08-01,,Virus Patch Takes Down US-Visit Border Screening System,There were delays at ports of entry for most of the day.,,,18,hours,18,,,,,US,The Americas,Operational Failure,Government,National,Customs,,http://archive.wired.com/science/discoveries/news/2006/04/70642?currentPage=all,,,airport/port/customs systems
2005-08-01,,UK National Air Traffic Control System Crashes,Numerous flights were delayed.,,,20,minutes,0.3333333333,,,,,UK,"Europe, Middle East, and Africa",Operational Failure,Commercial,,,Air Transport,http://www.informationweek.com/tech-workers-still-trying-to-solve-heathrow-computer-outage/d/d-id/1035497?,,,airport/port/customs systems
2005-10-01,,New AU$250 Million Australian Custom Service Integrated Cargo System Fails,Shipping disruptions in Australian ports persisted for over a year.,,,1,years,8766,,,,AUD,Australia,Asia Pacific and Japan,Operational Failure,Government,National,Customs,,http://www.theage.com.au/news/national/new-customs-it-cargo-system-fails-to-deliver/2005/10/20/1129775901865.html; http://www.3plwire.com/2006/10/11/australias-new-customs-system-still-experiencing-problems/,,,misc
2007-03-01,,US Airways New Integrated Reservation System Melts Down,The problem caused flight delays for a few days.,,,3,days,72,,,,,US,The Americas,Operational Failure,Commercial,,,Air Transport,http://usatoday30.usatoday.com/travel/flights/2007-03-05-us-airways-monday-update_N.htm; http://articles.philly.com/2007-03-06/business/25237309_1_passengers-kiosks-long-lines,,,airport/port/customs systems
2007-05-01,,All Nippon Airways Reservation System Crashes,"130 flights were cancelled and 306 flights were delayed, affecting nearly 70,000 passengers.",,,,,,69300,,,,Japan,Asia Pacific and Japan,Operational Failure,Commercial,,,Air Transport,http://www.infoworld.com/article/2662290/operating-systems/ana-still-in-the-dark-on-reservation-systems-failure.html,,,airport/port/customs systems
2007-05-01,,FAA San Diego TRACON Mapping Software Fails,"When TRACON has a problem, flights are delayed because they aren't allowed to take off.",,,1,hours,1,,,,,US,The Americas,Operational Failure,Government,National,Transportation,,http://spectrum.ieee.org/riskfactor/computing/it/a_system_burp,,,airport/port/customs systems
2007-06-01,,FAA Atlanta Air Traffic Control Center Computer Fails,Flight were cancelled and delayed along East Coast of the US.,,,4,hours,4,,,,,US,The Americas,Operational Failure,Government,National,Transportation,,http://spectrum.ieee.org/riskfactor/computing/it/a_system_burp,,,airport/port/customs systems
2007-06-01,,United Airlines Flight and Dispatch Goes Down,United flights were grounded worldwide for two hours.,,,2,hours,2,,,,,Worldwide,Worldwide,Operational Failure,Commercial,,,Air Transport,http://spectrum.ieee.org/riskfactor/computing/it/airline_systems_meltdowns,,,airport/port/customs systems
2008-02-01,,Software Update Crashes London Heathrow T4 Baggage System,"The crash affected the baggace of 4,000 passengers.",,,,,,4000,,,,UK,"Europe, Middle East, and Africa",Operational Failure,Commercial,,,Air Transport,http://spectrum.ieee.org/riskfactor/computing/it/baggage_meltdown_at_heathrow,,,airport/port/customs systems
2008-03-01,32000000,New London Heathrow T5 Baggage System Melts Down,"Six hundred thirty-six of flights were cancelled and delayed over the course a week and a half. Over 140,000 passengers and their bags were affected.",,,10,days,240,140000,32000000,$,USD,UK,"Europe, Middle East, and Africa",Operational Failure,Commercial,,,Air Transport,http://spectrum.ieee.org/riskfactor/computing/it/heathrow_terminal_5_a_bit_sham; http://www.dailymail.co.uk/news/article-558913/Thousands-lost-Terminal-5-bags-burnt-owners-traced.html; http://www.parliament.uk/business/news/2008/11/heathrow-terminal-5/; http://www.cnbc.com/id/23892979,,,airport/port/customs systems
2008-04-01,,New London Heathrow T5 Baggage System Melts Crash Again,Two dozen flights were canceled and dozens more were delayed.,,,1,days,24,,, ,,UK,"Europe, Middle East, and Africa",Operational Failure,Commercial,,,Air Transport,http://spectrum.ieee.org/riskfactor/computing/it/britsh_airways_terminal_5_back; http://www.telegraph.co.uk/news/uknews/1583995/New-baggage-problems-at-Heathrows-T5.html; http://edition.cnn.com/2008/BUSINESS/04/04/ba.terminal5/; http://www.parliament.uk/business/news/2008/11/heathrow-terminal-5/,,,airport/port/customs systems
2014-12-01,,UK NATS Software Problem Closes UK Airspace for Hours,Hundreds of flights were delayed and disrupted for two days after a 90 minute outage.,,,90,minutes,1.5,236000,,,,UK,"Europe, Middle East, and Africa",Operational Failure,Commercial,,,Air Transport,http://www.nytimes.com/2014/12/13/world/europe/london-air-traffic-glitch-closes-airspace-and-disrupts-flights.html?_r=0; http://www.itpro.co.uk/business-intelligence/24682/decades-old-bug-wiped-out-uk-air-traffic-control,,,airport/port/customs systems
2008-08-01,,FAA Computer Problems Stalls Flights Across Eastern US,"The outage lasted for hours, with hundreds of flights delayed.",,,3.5,hours,3.5,,,,,US,The Americas,Operational Failure,Government,National,Transportation,,http://spectrum.ieee.org/riskfactor/computing/it/software_problem_halts_us_flig,,,airport/port/customs systems
2008-09-01,,All Nippon Airways Reservation System Crashes,"53 domestic flights were cancelled with another 200 delayed. Over 51,000 passengers were affected.",,,7,hours,7,51000,,,,Japan,Asia Pacific and Japan,Operational Failure,Commercial,,,Air Transport,http://spectrum.ieee.org/riskfactor/computing/it/software_problems_halts_ana_fl,,,airport/port/customs systems
2012-06-01,419583260,Queensland Health AU$102 Million Payroll System Rollout a Fiasco,"The original estimated cost was AU$6.2 Million. At least $440 million is estiamted to have been spent developing the system. It still has problems, and an additional $100 million may be needed to fix the system completely. ",,,,,,,433800000,$,AUD,Australia,Asia Pacific and Japan,Operational Failure,Government,State/Local,Health and Human Services,,http://spectrum.ieee.org/riskfactor/computing/it/outstanding-success-or-nightmare-payroll-system-lawsuit-may-decide,,IBM,"payroll, health, project problems"
2009-07-01,,United Airlines Check-in System Crashes,The system was out for 6 hours and 40 minutes. Several flights had to be cancelled and dozens were delayed.,,,7,hours,6.66,,,,,US,The Americas,Operational Failure,Commercial,,,Air Transport,http://spectrum.ieee.org/riskfactor/computing/it/united-airlines-computer-go-out-at-ohare,,,airport/port/customs systems
2009-07-01,,US Customs Computers Crash Across US,Thousands of travelers were affected by the glitch that lasted for over four hours.,,,5,hours,4.66,,,,,US,The Americas,Operational Failure,Government,National,Customs,,http://spectrum.ieee.org/riskfactor/computing/it/another-computer-outage-at-ohare-airport,,,airport/port/customs systems
2009-11-01,,FAA's Atlanta Flight Planning System Problem Hits East Coast Flights,"The outage lasted four hours, delaying 819 flights.",,,4,hours,4,,,,,US,The Americas,Operational Failure,Government,National,Transportation,,http://spectrum.ieee.org/riskfactor/computing/it/faa-computer-problem-causes-widespread-flight-delays-in-us; http://www.aviationtoday.com/regions/usa/FAA-Adopts-FTI-Outage-Fixes_67959.html#.VbEKx_lVhBc,,,airport/port/customs systems
2010-04-01,,US Customs Computer Crashes Across US,Thousands of international passengers faced delays.,,,2,hours,2,,,,,US,The Americas,Operational Failure,Government,National,Customs,,http://spectrum.ieee.org/riskfactor/computing/it/us-customs-and-border-protection-computer-crashes-last-week-causing-delays-at-airports,,,airport/port/customs systems
2010-06-01,,Virgin Blue's New AU$10 Million Reservation & Ticketing System Crashes,Australian flights were delayed.,,,95,minutes,1.583333333,,,,AUD,Australia,Asia Pacific and Japan,Operational Failure,Commercial,,,Air Transport,http://spectrum.ieee.org/riskfactor/aerospace/aviation/virgin-blues-brand-new-airline-reservations-system-crashes; http://www.tnooz.com/article/virgin-blue-flights-delayed-as-navitaire-reservations-systems-crashes/,,,airport/port/customs systems
2010-09-01,,Virgin Blue's New AU$10 Million Reservation & Ticketing System Crashes Twice Within Days,"Over 50,000 passengers and 400 flights were affected.",,,21,hours,21,50000,,,AUD,Australia,Asia Pacific and Japan,Operational Failure,Commercial,,,Air Transport,http://spectrum.ieee.org/riskfactor/aerospace/aviation/up-to-100000-passengers-of-virgin-blue-in-australia-impacted-by-reservation-checkin-system-crash,,,airport/port/customs systems
2010-10-01,17496639,Virgin Blue Sues Reservation & Ticketing System Developer for AU$20 Million,The airline reportedly settled with Accenture-owned Navitaire for AU$18 million.,,,,,,,1.8E7,$,AUD,Australia,Asia Pacific and Japan,Operational Failure,Commercial,,,Air Transport,http://spectrum.ieee.org/riskfactor/aerospace/aviation/virgin-blue-may-want-a20-million-for-reservation-system-meltdown; http://www.theaustralian.com.au/business/navitaire-booking-glitch-earns-virgin-20m-in-compo/story-e6frg8zx-1226033624246,,"Northrop Grumman, Accenture, Navitaire",airport/port/customs systems
2011-05-01,,"US Diversity Visa Lottery Programming Error Means 22,000 Lottery Winners Aren't","State Dept. says the lottery wasn't fair, so will start over.",,,,,,22000,,,,US,The Americas,Operational Failure,Government,National,Customs,,http://spectrum.ieee.org/riskfactor/computing/software/us-diversity-visa-lottery-programming-problem-22000-unhappy-147-million-happy-about-the-glitch,,,airport/port/customs systems
2011-11-01,,Amadeus Reservation System Glitch Affects Airlines Worldwide,"Boarding passes had to be printed out by hand by Qantas, BA, Air France, and Lufthansa for several hours.",,,140,minutes,2.333333333,,,,,Worldwide,Worldwide,Operational Failure,Commercial,,,Air Transport,http://spectrum.ieee.org/riskfactor/aerospace/aviation/worldwide-airline-reservation-hiccup-cured,,,airport/port/customs systems
2012-03-01,,United-Continental Merged Reservation System Hits Major Turbulence,"United CEO claimed that system was well prepared, but it was anything but.",,,1,months,730,,,,,US,The Americas,Operational Failure,Commercial,,,Air Transport,http://spectrum.ieee.org/riskfactor/aerospace/aviation/united-airlines-reservation-system-cutover-still-hitting-patches-of-rough-air; http://www.npr.org/sections/thetwo-way/2012/08/28/160203793/computer-troubles-freeze-united-airlines-system-bringing-a-cascade-of-delays,,,airport/port/customs systems
2012-10-01,,Sprint Cable Cuts Hit Airlines using Sabre Reservation System,"Alaska, American, Frontier and SouthWest were all affected.",,,5.75,hours,5.75,7000,,,,US,The Americas,Operational Failure,Commercial,,,Telecom,http://spectrum.ieee.org/riskfactor/aerospace/aviation/sprint-cable-cuts-smack-alaska-airlines-hard,,,"airport/port/customs systems, telecom"
2013-04-01,,American Airlines Reservation System Out for Over Four Hours Due to Software Issue,"Connectivity issues cited, 970 flights canceled and 1068 delayed",,,4.5,hours,4.5,,,,,Worldwide,Worldwide,Operational Failure,Commercial,,,Air Transport,http://spectrum.ieee.org/riskfactor/aerospace/aviation/american-airlines-still-recovering-from-software-issue-that-grounded-flights-yesterday,,,airport/port/customs systems
2013-06-01,,Southwest Airlines Grounds Entire Fleet for Three Hours After Computer Failure,"57 Flights were cancelled, and 250 others were grounded.",,,3,hours,3,,,,,US,The Americas,Operational Failure,Commercial,,,Air Transport,http://spectrum.ieee.org/riskfactor/computing/it/it-hiccups-of-the-week-southwest-airlines-computer-failure-grounded-all-flights,,,airport/port/customs systems
2013-08-01,,Sabre Reservation System Experiences Worldwide Outage for 2 Hours,"Dozens of flights around the world were canceled, and many more were delayed.",,,2.5,hours,2.5,,,,,Worldwide,Worldwide,Operational Failure,Commercial,,,Air Transport,http://spectrum.ieee.org/riskfactor/computing/it/it-hiccups-of-the-week-sabre-outage-hit-flights-worldwide,,,airport/port/customs systems
2013-12-01,,"UK NATS System Crashes, Snarls Air Traffic Across Britain and Europe","300 flights were cancelled and another 1,400 flights delayed over the course of two days.",,,13,hours,13,,,,,UK,"Europe, Middle East, and Africa",Operational Failure,Commercial,,,Air Transport,http://spectrum.ieee.org/riskfactor/computing/it/uk-air-traffic-control-problem-snarls-flights-over-weekend; http://www.techweekeurope.co.uk/workspace/air-traffic-control-software-glitch-133716; http://www.ft.com/intl/cms/s/0/65544730-8216-11e4-b9d0-00144feabdc0.html#axzz3gjQXQL2y,,,airport/port/customs systems
2014-03-01,685329462,UK £750 Million e-Borders Project Finally Ends,"The UK government eventually agreed to a cost of 409.3 Million pounds (£259.3 Million in initial costs, and a £150 Million contract termination fee). ",,,,,,,409300000,£,GBP,UK,"Europe, Middle East, and Africa",Project Failure,Government,National,Customs,,http://www.computerweekly.com/news/2240216029/Government-finally-scraps-e-Borders-programme; https://www.gov.uk/government/news/home-secretary-letter-on-the-e-borders-programme-arbitration; http://www.bizjournals.com/boston/blog/techflash/2015/03/raytheon-u-k-subsidiary-reaches-223m-settlement.html ,,Raytheon,"airport/port/customs systems, project termination/cancellation"
2014-05-01,,U2 Flight Exposes Software Flaw in FAA Air Traffic Control System,Air traffic in four Western States was affected by trouble with En Route Automation Modernization (ERAM) system.,,,1,hours,1,,,,,US,The Americas,Operational Failure,Government,National,Transportation,,http://spectrum.ieee.org/riskfactor/computing/it/report-claims-u2-to-blame-for-us-west-coast-airtraffic-outage,,,airport/port/customs systems
2014-06-01,,Heathrow Terminal 5 Has Multi-day Baggage System Problems,Thousands of passengers had to fly without bags.,,,3,days,72,5000,,,,UK,"Europe, Middle East, and Africa",Operational Failure,Commercial,,,Air Transport,http://spectrum.ieee.org/riskfactor/computing/it/thousands-of-bags-miss-flights-at-british-airways-heathrow-terminal-5-again; http://www.telegraph.co.uk/travel/travelnews/5676256/Thousands-stranded-by-Heathrow-Terminal-5-baggage-failure.html,,,airport/port/customs systems
2012-03-01,5.56E8,California Cancels Court Case Management System After Spending $556 Million,Another $1.3 Billion would be needed to finish the system.,,,,,,,5.56E8,$,USD,US,The Americas,Project Failure,Government,State/Local,Law Enforcement,,http://www.ocregister.com/taxdollars/strong-478664-project-million.html,,,project termination/cancellation
2006-07-01,28400000,University of Wisconsin Cancels Payroll and Benefits System,The failed project cost $28.4 Million.,,,,,,,28400000,$,USD,US,The Americas,Project Failure,Government,State/Local,Education,,http://legis.wisconsin.gov/lab/reports/07-5Full.pdf,,,"project termination/cancellation, payroll"
